{
  "$schema": "https://json-schema.org/draft/2020-12/schema",
  "$id": "raziel:data/schemas/query_family.schema.json@1.0.0",
  "title": "Query family",
  "description": "One evaluation query family. A family has a canonical query plus exactly two INDEPENDENTLY written paraphrases (variants are not independent families, §21.3). It carries the declared scope, zero/one/many ground-truth intervals, atom/relation/logic labels, typed challengers, assessability and boundary labels, and track/logic ground truth. Test ground truth is human-derived and never from retriever proposals. Empty-set (cardinality=zero) families require full human review of the declared scope. Composes the other data/schemas/*.schema.json via $ref. See RAZIEL_Master_Execution_Plan_v1.3.md §21.3, §21.5.",
  "type": "object",
  "additionalProperties": false,
  "required": [
    "family_schema_version",
    "family_id",
    "pool",
    "split",
    "scenario_id",
    "canonical_query",
    "paraphrases",
    "scope",
    "ground_truth",
    "labels",
    "ground_truth_source",
    "empty_set_review",
    "synthetic"
  ],
  "properties": {
    "family_schema_version": { "const": "1.0.0" },
    "family_id": { "type": "string", "minLength": 1 },
    "pool": { "enum": ["staged", "organizer"] },
    "split": {
      "enum": ["train", "dev", "test"],
      "description": "Assigned by scenario/session. All families of one scenario_id share one split; a session never straddles splits (enforced by eval/schema.py)."
    },
    "scenario_id": { "type": "string", "minLength": 1 },
    "session_ids": {
      "type": "array",
      "items": { "type": "string" },
      "description": "Sessions this family draws ground truth from. Used for leakage checks."
    },
    "capability_tags": {
      "type": "array",
      "description": "Which supported capabilities this family exercises (for coverage reporting).",
      "items": {
        "enum": ["object", "attribute", "action", "binding", "location", "temporal_order", "multi_occurrence", "empty_set", "ambiguous", "bounded_or", "visible_absence", "bounded_count", "unobservable", "long_gap_identity_rejection"]
      }
    },
    "canonical_query": { "type": "string", "minLength": 1 },
    "paraphrases": {
      "type": "array",
      "minItems": 2,
      "maxItems": 2,
      "description": "Exactly two paraphrases, each written independently by a different author (author_id must differ; enforced by eval/schema.py).",
      "items": {
        "type": "object",
        "additionalProperties": false,
        "required": ["text", "author_id", "written_independently"],
        "properties": {
          "text": { "type": "string", "minLength": 1 },
          "author_id": { "type": "string", "minLength": 1 },
          "written_independently": { "const": true }
        }
      }
    },
    "scope": {
      "type": "object",
      "additionalProperties": false,
      "required": ["video_ids", "camera_ids", "sampling_policy_version"],
      "description": "Declared search scope. All claims are conditional on this scope and sampling policy.",
      "properties": {
        "video_ids": { "type": "array", "items": { "type": "string" } },
        "camera_ids": { "type": "array", "items": { "type": "string" } },
        "start_time": { "type": ["number", "null"], "minimum": 0 },
        "end_time": { "type": ["number", "null"], "minimum": 0 },
        "sampling_policy_version": { "type": "string", "minLength": 1 }
      }
    },
    "ground_truth": {
      "type": "object",
      "additionalProperties": false,
      "required": ["intervals", "atoms_relations"],
      "properties": {
        "intervals": { "$ref": "interval.schema.json" },
        "atoms_relations": { "$ref": "atom_relation_state.schema.json" },
        "track_logic": { "$ref": "track_logic_ground_truth.schema.json" }
      }
    },
    "labels": {
      "type": "object",
      "additionalProperties": false,
      "description": "boundary is present for families with a target event to bound; it is omitted for empty-set (cardinality=zero) families.",
      "required": ["assessability"],
      "properties": {
        "assessability": { "$ref": "assessability_boundary.schema.json#/$defs/Assessability" },
        "boundary": { "$ref": "assessability_boundary.schema.json#/$defs/BoundaryLabel" }
      }
    },
    "challengers": {
      "type": "array",
      "items": { "$ref": "challenger.schema.json" }
    },
    "ground_truth_source": {
      "const": "human_ledger",
      "description": "Test truth is human-derived from the ledger. Retriever/auto proposals are prohibited as a source of test truth (§21.5)."
    },
    "empty_set_review": {
      "type": "object",
      "additionalProperties": false,
      "required": ["required", "review_complete"],
      "description": "For cardinality=zero families, full human review of the declared scope is required and must be complete before the family is usable for test.",
      "properties": {
        "required": { "type": "boolean" },
        "reviewed_by": { "type": "array", "items": { "type": "string" } },
        "review_complete": { "type": "boolean" }
      }
    },
    "notes": { "type": "string" },
    "synthetic": { "type": "boolean" }
  }
}
