{
  "family_schema_version": "1.0.0",
  "family_id": "fam_0017",
  "pool": "staged",
  "split": "train",
  "scenario_id": "scn_hat",
  "session_ids": [
    "sess_hat"
  ],
  "capability_tags": [
    "bounded_or",
    "attribute"
  ],
  "canonical_query": "a person wearing a red or blue hat",
  "paraphrases": [
    {
      "text": "someone in a red or blue cap",
      "author_id": "auth_1",
      "written_independently": true
    },
    {
      "text": "a person with a hat that is either red or blue",
      "author_id": "auth_3",
      "written_independently": true
    }
  ],
  "scope": {
    "video_ids": [
      "sess_hat_v1"
    ],
    "camera_ids": [
      "cam_hat"
    ],
    "start_time": null,
    "end_time": null,
    "sampling_policy_version": "sampling-1.0.0"
  },
  "ground_truth": {
    "intervals": {
      "cardinality": "one",
      "intervals": [
        {
          "video_id": "sess_hat_v1",
          "camera_id": "cam_hat",
          "t0": 55.0,
          "t1": 68.0,
          "boundary": {
            "start_pts": 55.0,
            "end_pts": 68.0,
            "tolerance_s": 1.0,
            "source": "human_ledger"
          }
        }
      ]
    },
    "atoms_relations": {
      "atoms": [
        {
          "atom_id": "a1",
          "text_span": "a person",
          "type": "object",
          "required": true,
          "role": "candidate_anchor",
          "gt_state": "supported"
        },
        {
          "atom_id": "a2",
          "text_span": "red hat",
          "type": "attribute",
          "required": false,
          "visibility_sensitive": true,
          "gt_state": "contradicted"
        },
        {
          "atom_id": "a3",
          "text_span": "blue hat",
          "type": "attribute",
          "required": false,
          "visibility_sensitive": true,
          "gt_state": "supported"
        }
      ],
      "logic_groups": [
        {
          "group_id": "g1",
          "operator": "any",
          "atom_ids": [
            "a2",
            "a3"
          ],
          "observation_scope": "candidate_episode",
          "gt_outcome": "satisfied",
          "min_count": null,
          "max_count": null
        }
      ]
    },
    "track_logic": {
      "disjunction_gt": [
        {
          "group_id": "g1",
          "alternatives": [
            "red hat",
            "blue hat"
          ],
          "present_alternatives": [
            "blue hat"
          ],
          "expected_outcome": "satisfied"
        }
      ]
    }
  },
  "labels": {
    "assessability": {
      "overall": "assessable",
      "reasons": [
        "clear"
      ]
    },
    "boundary": {
      "start_pts": 55.0,
      "end_pts": 68.0,
      "tolerance_s": 1.0,
      "source": "human_ledger"
    }
  },
  "ground_truth_source": "human_ledger",
  "empty_set_review": {
    "required": false,
    "review_complete": false
  },
  "synthetic": true,
  "challengers": [
    {
      "challenger_id": "ch_0017a",
      "family_id": "fam_0017",
      "type": "bounded_disjunction",
      "description": "a person in a green hat (neither red nor blue)",
      "expected": {
        "archive_conclusion": "no_verified_match_at_operating_point",
        "logic_outcome": "not_satisfied"
      },
      "synthetic": true
    }
  ]
}
