{
  "family_schema_version": "1.0.0",
  "family_id": "fam_0003",
  "pool": "staged",
  "split": "train",
  "scenario_id": "scn_gate_a",
  "session_ids": [
    "sess_gate_a"
  ],
  "capability_tags": [
    "object",
    "action"
  ],
  "canonical_query": "someone leaves a bag on the ground",
  "paraphrases": [
    {
      "text": "a person sets a bag down and leaves it",
      "author_id": "auth_2",
      "written_independently": true
    },
    {
      "text": "somebody abandons a bag on the floor",
      "author_id": "auth_3",
      "written_independently": true
    }
  ],
  "scope": {
    "video_ids": [
      "sess_gate_a_v1"
    ],
    "camera_ids": [
      "cam_gate"
    ],
    "start_time": null,
    "end_time": null,
    "sampling_policy_version": "sampling-1.0.0"
  },
  "ground_truth": {
    "intervals": {
      "cardinality": "one",
      "intervals": [
        {
          "video_id": "sess_gate_a_v1",
          "camera_id": "cam_gate",
          "t0": 210.0,
          "t1": 224.0,
          "boundary": {
            "start_pts": 210.0,
            "end_pts": 224.0,
            "tolerance_s": 1.0,
            "source": "human_ledger"
          }
        }
      ]
    },
    "atoms_relations": {
      "atoms": [
        {
          "atom_id": "a1",
          "text_span": "someone",
          "type": "object",
          "required": true,
          "role": "candidate_anchor",
          "gt_state": "supported"
        },
        {
          "atom_id": "a2",
          "text_span": "a bag",
          "type": "object",
          "required": true,
          "gt_state": "supported"
        },
        {
          "atom_id": "a3",
          "text_span": "leaves on the ground",
          "type": "action",
          "required": true,
          "gt_state": "supported"
        }
      ],
      "relations": [
        {
          "relation_id": "r1",
          "subject_atom": "a1",
          "predicate": "places",
          "object_atom": "a2",
          "required": true,
          "gt_state": "supported"
        }
      ]
    }
  },
  "labels": {
    "assessability": {
      "overall": "assessable",
      "reasons": [
        "clear"
      ]
    },
    "boundary": {
      "start_pts": 210.0,
      "end_pts": 224.0,
      "tolerance_s": 1.0,
      "source": "human_ledger"
    }
  },
  "ground_truth_source": "human_ledger",
  "empty_set_review": {
    "required": false,
    "review_complete": false
  },
  "synthetic": true,
  "challengers": [
    {
      "challenger_id": "ch_0003a",
      "family_id": "fam_0003",
      "type": "short_interruption",
      "description": "the person sets the bag down but picks it up again two seconds later (not abandonment)",
      "expected": {
        "archive_conclusion": "no_verified_match_at_operating_point",
        "rejected_reason": "abandonment contradicted by immediate pick-up"
      },
      "synthetic": true
    }
  ]
}
