{
  "family_schema_version": "1.0.0",
  "family_id": "fam_0004",
  "pool": "staged",
  "split": "train",
  "scenario_id": "scn_gate_a",
  "session_ids": [
    "sess_gate_a"
  ],
  "capability_tags": [
    "action",
    "multi_occurrence",
    "location"
  ],
  "canonical_query": "a person walks past the gate",
  "paraphrases": [
    {
      "text": "someone passes by the gate on foot",
      "author_id": "auth_1",
      "written_independently": true
    },
    {
      "text": "a pedestrian goes past the gate",
      "author_id": "auth_2",
      "written_independently": true
    }
  ],
  "scope": {
    "video_ids": [
      "sess_gate_a_v1"
    ],
    "camera_ids": [
      "cam_gate"
    ],
    "start_time": null,
    "end_time": null,
    "sampling_policy_version": "sampling-1.0.0"
  },
  "ground_truth": {
    "intervals": {
      "cardinality": "many",
      "intervals": [
        {
          "video_id": "sess_gate_a_v1",
          "camera_id": "cam_gate",
          "t0": 60.0,
          "t1": 66.0,
          "boundary": {
            "start_pts": 60.0,
            "end_pts": 66.0,
            "tolerance_s": 1.0,
            "source": "human_ledger"
          },
          "repeated_event_group": "grp_walk"
        },
        {
          "video_id": "sess_gate_a_v1",
          "camera_id": "cam_gate",
          "t0": 300.0,
          "t1": 306.0,
          "boundary": {
            "start_pts": 300.0,
            "end_pts": 306.0,
            "tolerance_s": 1.0,
            "source": "human_ledger"
          },
          "repeated_event_group": "grp_walk"
        },
        {
          "video_id": "sess_gate_a_v1",
          "camera_id": "cam_gate",
          "t0": 500.0,
          "t1": 507.0,
          "boundary": {
            "start_pts": 500.0,
            "end_pts": 507.0,
            "tolerance_s": 1.0,
            "source": "human_ledger"
          },
          "repeated_event_group": "grp_walk"
        }
      ]
    },
    "atoms_relations": {
      "atoms": [
        {
          "atom_id": "a1",
          "text_span": "a person",
          "type": "object",
          "required": true,
          "role": "candidate_anchor",
          "gt_state": "supported"
        },
        {
          "atom_id": "a2",
          "text_span": "walks past",
          "type": "action",
          "required": true,
          "gt_state": "supported"
        },
        {
          "atom_id": "a3",
          "text_span": "the gate",
          "type": "location",
          "required": true,
          "role": "filter",
          "gt_state": "supported"
        }
      ]
    }
  },
  "labels": {
    "assessability": {
      "overall": "assessable",
      "reasons": [
        "clear"
      ]
    },
    "boundary": {
      "start_pts": 60.0,
      "end_pts": 66.0,
      "tolerance_s": 1.0,
      "source": "human_ledger"
    }
  },
  "ground_truth_source": "human_ledger",
  "empty_set_review": {
    "required": false,
    "review_complete": false
  },
  "synthetic": true,
  "challengers": [
    {
      "challenger_id": "ch_0004a",
      "family_id": "fam_0004",
      "type": "repeated_events",
      "description": "three separate pass-bys must all be returned (complete-set)",
      "expected": {
        "archive_conclusion": "verified_matches_found"
      },
      "synthetic": true
    }
  ]
}
