{
  "family_schema_version": "1.0.0",
  "family_id": "fam_0038",
  "pool": "organizer",
  "split": "test",
  "scenario_id": "scn_org_b",
  "session_ids": [
    "sess_org_b"
  ],
  "capability_tags": [
    "temporal_order",
    "action"
  ],
  "canonical_query": "a forklift moves a pallet then reverses",
  "paraphrases": [
    {
      "text": "a forklift carries a pallet and then backs up",
      "author_id": "auth_2",
      "written_independently": true
    },
    {
      "text": "a forklift shifts a pallet and reverses afterward",
      "author_id": "auth_3",
      "written_independently": true
    }
  ],
  "scope": {
    "video_ids": [
      "sess_org_b_v1"
    ],
    "camera_ids": [
      "cam_orgB"
    ],
    "start_time": null,
    "end_time": null,
    "sampling_policy_version": "sampling-1.0.0"
  },
  "ground_truth": {
    "intervals": {
      "cardinality": "one",
      "intervals": [
        {
          "video_id": "sess_org_b_v1",
          "camera_id": "cam_orgB",
          "t0": 200.0,
          "t1": 235.0,
          "boundary": {
            "start_pts": 200.0,
            "end_pts": 235.0,
            "tolerance_s": 1.0,
            "source": "human_ledger"
          }
        }
      ]
    },
    "atoms_relations": {
      "atoms": [
        {
          "atom_id": "a1",
          "text_span": "a forklift",
          "type": "object",
          "required": true,
          "role": "candidate_anchor",
          "gt_state": "supported"
        },
        {
          "atom_id": "a2",
          "text_span": "a pallet",
          "type": "object",
          "required": true,
          "gt_state": "supported"
        },
        {
          "atom_id": "a3",
          "text_span": "moves the pallet",
          "type": "action",
          "required": true,
          "gt_state": "supported"
        },
        {
          "atom_id": "a4",
          "text_span": "reverses",
          "type": "action",
          "required": true,
          "gt_state": "supported"
        }
      ],
      "temporal_relations": [
        {
          "first_atom": "a3",
          "relation": "before",
          "second_atom": "a4",
          "same_actor_required": true,
          "max_gap_s": 60
        }
      ]
    }
  },
  "labels": {
    "assessability": {
      "overall": "assessable",
      "reasons": [
        "clear"
      ]
    },
    "boundary": {
      "start_pts": 200.0,
      "end_pts": 235.0,
      "tolerance_s": 1.0,
      "source": "human_ledger"
    }
  },
  "ground_truth_source": "human_ledger",
  "empty_set_review": {
    "required": false,
    "review_complete": false
  },
  "synthetic": true,
  "notes": "Organizer pool, authorization PENDING."
}
