{
  "family_schema_version": "1.0.0",
  "family_id": "fam_0021",
  "pool": "staged",
  "split": "test",
  "scenario_id": "scn_dark_b",
  "session_ids": [
    "sess_dark_b"
  ],
  "capability_tags": [
    "unobservable"
  ],
  "canonical_query": "the licence plate of the parked car",
  "paraphrases": [
    {
      "text": "read the number plate of the parked car",
      "author_id": "auth_1",
      "written_independently": true
    },
    {
      "text": "the registration plate on the parked vehicle",
      "author_id": "auth_2",
      "written_independently": true
    }
  ],
  "scope": {
    "video_ids": [
      "sess_dark_b_v1"
    ],
    "camera_ids": [
      "cam_dark"
    ],
    "start_time": null,
    "end_time": null,
    "sampling_policy_version": "sampling-1.0.0"
  },
  "ground_truth": {
    "intervals": {
      "cardinality": "zero",
      "intervals": []
    },
    "atoms_relations": {
      "atoms": [
        {
          "atom_id": "a1",
          "text_span": "the parked car",
          "type": "object",
          "required": true,
          "role": "candidate_anchor",
          "gt_state": "supported"
        },
        {
          "atom_id": "a2",
          "text_span": "licence plate text",
          "type": "attribute",
          "required": true,
          "visibility_sensitive": true,
          "gt_state": "unobservable",
          "gt_reason": "out_of_frame"
        }
      ]
    }
  },
  "labels": {
    "assessability": {
      "overall": "unassessable",
      "reasons": [
        "resolution",
        "out_of_frame"
      ]
    }
  },
  "ground_truth_source": "human_ledger",
  "empty_set_review": {
    "required": true,
    "reviewed_by": [
      "annotator_A1",
      "annotator_A2"
    ],
    "review_complete": true
  },
  "synthetic": true,
  "notes": "Plate not legible at this resolution/angle -> unobservable, no fabricated read."
}
