{
  "family_schema_version": "1.0.0",
  "family_id": "fam_0028",
  "pool": "staged",
  "split": "test",
  "scenario_id": "scn_cross_b",
  "session_ids": [
    "sess_cross_b"
  ],
  "capability_tags": [
    "temporal_order",
    "action"
  ],
  "canonical_query": "a vehicle stops and then a person exits it",
  "paraphrases": [
    {
      "text": "a car halts and someone gets out",
      "author_id": "auth_3",
      "written_independently": true
    },
    {
      "text": "a vehicle comes to a stop and a person steps out",
      "author_id": "auth_1",
      "written_independently": true
    }
  ],
  "scope": {
    "video_ids": [
      "sess_cross_b_v1"
    ],
    "camera_ids": [
      "cam_cross"
    ],
    "start_time": null,
    "end_time": null,
    "sampling_policy_version": "sampling-1.0.0"
  },
  "ground_truth": {
    "intervals": {
      "cardinality": "one",
      "intervals": [
        {
          "video_id": "sess_cross_b_v1",
          "camera_id": "cam_cross",
          "t0": 400.0,
          "t1": 430.0,
          "boundary": {
            "start_pts": 400.0,
            "end_pts": 430.0,
            "tolerance_s": 1.0,
            "source": "human_ledger"
          }
        }
      ]
    },
    "atoms_relations": {
      "atoms": [
        {
          "atom_id": "a1",
          "text_span": "a vehicle",
          "type": "object",
          "required": true,
          "role": "candidate_anchor",
          "gt_state": "supported"
        },
        {
          "atom_id": "a2",
          "text_span": "stops",
          "type": "action",
          "required": true,
          "gt_state": "supported"
        },
        {
          "atom_id": "a3",
          "text_span": "a person",
          "type": "object",
          "required": true,
          "gt_state": "supported"
        },
        {
          "atom_id": "a4",
          "text_span": "exits the vehicle",
          "type": "action",
          "required": true,
          "gt_state": "supported"
        }
      ],
      "temporal_relations": [
        {
          "first_atom": "a2",
          "relation": "before",
          "second_atom": "a4",
          "same_actor_required": false,
          "max_gap_s": 30
        }
      ]
    }
  },
  "labels": {
    "assessability": {
      "overall": "assessable",
      "reasons": [
        "clear"
      ]
    },
    "boundary": {
      "start_pts": 400.0,
      "end_pts": 430.0,
      "tolerance_s": 1.0,
      "source": "human_ledger"
    }
  },
  "ground_truth_source": "human_ledger",
  "empty_set_review": {
    "required": false,
    "review_complete": false
  },
  "synthetic": true
}
