{
  "family_schema_version": "1.0.0",
  "family_id": "fam_0022",
  "pool": "staged",
  "split": "test",
  "scenario_id": "scn_lobby",
  "session_ids": [
    "sess_lobby"
  ],
  "capability_tags": [
    "empty_set"
  ],
  "canonical_query": "a person carrying a yellow umbrella in the lobby",
  "paraphrases": [
    {
      "text": "someone with a yellow umbrella in the lobby",
      "author_id": "auth_2",
      "written_independently": true
    },
    {
      "text": "a person holding a yellow brolly in the lobby",
      "author_id": "auth_3",
      "written_independently": true
    }
  ],
  "scope": {
    "video_ids": [
      "sess_lobby_v1"
    ],
    "camera_ids": [
      "cam_lobby"
    ],
    "start_time": null,
    "end_time": null,
    "sampling_policy_version": "sampling-1.0.0"
  },
  "ground_truth": {
    "intervals": {
      "cardinality": "zero",
      "intervals": []
    },
    "atoms_relations": {
      "atoms": [
        {
          "atom_id": "a1",
          "text_span": "a person",
          "type": "object",
          "required": true,
          "role": "candidate_anchor"
        },
        {
          "atom_id": "a2",
          "text_span": "yellow umbrella",
          "type": "object",
          "required": true,
          "visibility_sensitive": true
        }
      ]
    }
  },
  "labels": {
    "assessability": {
      "overall": "assessable",
      "reasons": [
        "clear"
      ]
    }
  },
  "ground_truth_source": "human_ledger",
  "empty_set_review": {
    "required": true,
    "reviewed_by": [
      "annotator_A1",
      "annotator_A2"
    ],
    "review_complete": true
  },
  "synthetic": true,
  "challengers": [
    {
      "challenger_id": "ch_0022a",
      "family_id": "fam_0022",
      "type": "true_no_event",
      "description": "no yellow umbrella appears anywhere in the reviewed scope",
      "expected": {
        "archive_conclusion": "no_verified_match_at_operating_point"
      },
      "synthetic": true
    }
  ],
  "notes": "Reviewed full scope: no such event -> NO VERIFIED MATCH AT CURRENT OPERATING POINT."
}
